{
  "$schema": "./schemas/traits.schema.json",
  "config_name": "traits",
  "version": "1.0.0",
  "spec_reference": "sinking-ship-master-spec.md Section 3 (trait system) + 4.1/4.2 (buckets)",
  "notes": [
    "Trait counts follow the spec's per-layer LISTS, which the Section 7 art budget confirms; several section-header counts are stale (Sky '14' lists 15, Ship Class '14' lists 16, Condition '9' lists 11, Eyes '15' lists 16, Hat '14 + None' lists 13 + None).",
    "rarity_bucket assignments marked 'bucket fixed by spec' come from the Section 4.2 example table; all others are proposals consistent with depth-equals-rarity and are tunable without code changes.",
    "roll_order differs from z_order so that every bias/pairing rule points forward during sequential rolling (ADR-0003)."
  ],
  "grid": {
    "master_px": 48,
    "upscales": [
      2048,
      4000
    ]
  },
  "roll_order": [
    "body",
    "ship_class",
    "ship_condition",
    "sky",
    "sea",
    "scene_element",
    "clothing",
    "eyes",
    "hat",
    "mouth",
    "pose",
    "aura"
  ],
  "layers": [
    {
      "name": "sky",
      "display_name": "Sky",
      "z_order": 1,
      "required": true,
      "traits": [
        {
          "name": "Calm Blue",
          "sprite_filename": "calm_blue.png",
          "rarity_bucket": "common",
          "notes": "bucket fixed by spec Section 4.2 example"
        },
        {
          "name": "Overcast",
          "sprite_filename": "overcast.png",
          "rarity_bucket": "common"
        },
        {
          "name": "Orange Sunset",
          "sprite_filename": "orange_sunset.png",
          "rarity_bucket": "uncommon",
          "notes": "bucket fixed by spec Section 4.2 example"
        },
        {
          "name": "Golden Sunset",
          "sprite_filename": "golden_sunset.png",
          "rarity_bucket": "uncommon"
        },
        {
          "name": "Moonlit",
          "sprite_filename": "moonlit.png",
          "rarity_bucket": "uncommon"
        },
        {
          "name": "Heavy Rain",
          "sprite_filename": "heavy_rain.png",
          "rarity_bucket": "uncommon"
        },
        {
          "name": "Fog",
          "sprite_filename": "fog.png",
          "rarity_bucket": "uncommon"
        },
        {
          "name": "Lightning",
          "sprite_filename": "lightning.png",
          "rarity_bucket": "rare"
        },
        {
          "name": "Purple Storm",
          "sprite_filename": "purple_storm.png",
          "rarity_bucket": "rare"
        },
        {
          "name": "Aurora",
          "sprite_filename": "aurora.png",
          "rarity_bucket": "rare",
          "notes": "bucket fixed by spec Section 4.2 example"
        },
        {
          "name": "Green Aurora",
          "sprite_filename": "green_aurora.png",
          "rarity_bucket": "rare"
        },
        {
          "name": "Meteor Shower",
          "sprite_filename": "meteor_shower.png",
          "rarity_bucket": "epic"
        },
        {
          "name": "Blood Moon",
          "sprite_filename": "blood_moon.png",
          "rarity_bucket": "epic",
          "notes": "bucket fixed by spec Section 4.2 example"
        },
        {
          "name": "Fire Sky",
          "sprite_filename": "fire_sky.png",
          "rarity_bucket": "epic"
        },
        {
          "name": "Solar Eclipse",
          "sprite_filename": "solar_eclipse.png",
          "rarity_bucket": "legendary",
          "notes": "bucket fixed by spec Section 4.2 example"
        }
      ]
    },
    {
      "name": "sea",
      "display_name": "Sea",
      "z_order": 2,
      "required": true,
      "traits": [
        {
          "name": "Calm",
          "sprite_filename": "calm.png",
          "rarity_bucket": "common"
        },
        {
          "name": "Storm Swell",
          "sprite_filename": "storm_swell.png",
          "rarity_bucket": "uncommon"
        },
        {
          "name": "Black Sea",
          "sprite_filename": "black_sea.png",
          "rarity_bucket": "uncommon"
        },
        {
          "name": "Frozen",
          "sprite_filename": "frozen.png",
          "rarity_bucket": "rare"
        },
        {
          "name": "Emerald Water",
          "sprite_filename": "emerald_water.png",
          "rarity_bucket": "rare"
        },
        {
          "name": "Red Water",
          "sprite_filename": "red_water.png",
          "rarity_bucket": "rare"
        },
        {
          "name": "Whirlpool",
          "sprite_filename": "whirlpool.png",
          "rarity_bucket": "epic"
        },
        {
          "name": "Glass Sea",
          "sprite_filename": "glass_sea.png",
          "rarity_bucket": "epic",
          "notes": "mirror-still, eerie"
        },
        {
          "name": "Abyss",
          "sprite_filename": "abyss.png",
          "rarity_bucket": "epic"
        },
        {
          "name": "Bioluminescent",
          "sprite_filename": "bioluminescent.png",
          "rarity_bucket": "legendary"
        },
        {
          "name": "Chia-Green Tide",
          "sprite_filename": "chia_green_tide.png",
          "rarity_bucket": "mythic",
          "notes": "Chia-coded traits sit at the top of the rarity ladder"
        }
      ]
    },
    {
      "name": "scene_element",
      "display_name": "Scene Element",
      "z_order": 3,
      "required": false,
      "traits": [
        {
          "name": "None",
          "sprite_filename": null,
          "rarity_bucket": "none",
          "notes": "majority of supply — keeps the composition clean (spec 3.3)"
        },
        {
          "name": "Abandoned Harbor",
          "sprite_filename": "harbor_abandoned_harbor.png",
          "rarity_bucket": "common",
          "series": "harbor"
        },
        {
          "name": "Broken Pier",
          "sprite_filename": "harbor_broken_pier.png",
          "rarity_bucket": "common",
          "series": "harbor"
        },
        {
          "name": "Storm Harbor",
          "sprite_filename": "harbor_storm_harbor.png",
          "rarity_bucket": "uncommon",
          "series": "harbor"
        },
        {
          "name": "Ship Graveyard",
          "sprite_filename": "harbor_ship_graveyard.png",
          "rarity_bucket": "uncommon",
          "series": "harbor"
        },
        {
          "name": "Dry Dock",
          "sprite_filename": "harbor_dry_dock.png",
          "rarity_bucket": "uncommon",
          "series": "harbor"
        },
        {
          "name": "Lighthouse",
          "sprite_filename": "harbor_lighthouse.png",
          "rarity_bucket": "rare",
          "series": "harbor"
        },
        {
          "name": "Military Port",
          "sprite_filename": "harbor_military_port.png",
          "rarity_bucket": "rare",
          "series": "harbor"
        },
        {
          "name": "Pirate Cove",
          "sprite_filename": "harbor_pirate_cove.png",
          "rarity_bucket": "rare",
          "series": "harbor"
        },
        {
          "name": "Wizard Harbor",
          "sprite_filename": "harbor_wizard_harbor.png",
          "rarity_bucket": "epic",
          "series": "harbor"
        },
        {
          "name": "Convoy Silhouettes",
          "sprite_filename": "military_convoy_silhouettes.png",
          "rarity_bucket": "uncommon",
          "series": "military"
        },
        {
          "name": "Artillery Smoke",
          "sprite_filename": "military_artillery_smoke.png",
          "rarity_bucket": "uncommon",
          "series": "military"
        },
        {
          "name": "Searchlights",
          "sprite_filename": "military_searchlights.png",
          "rarity_bucket": "rare",
          "series": "military"
        },
        {
          "name": "Signal Flags",
          "sprite_filename": "military_signal_flags.png",
          "rarity_bucket": "rare",
          "series": "military"
        },
        {
          "name": "Cargo Drop",
          "sprite_filename": "military_cargo_drop.png",
          "rarity_bucket": "epic",
          "series": "military"
        },
        {
          "name": "Helicopter",
          "sprite_filename": "military_helicopter.png",
          "rarity_bucket": "epic",
          "series": "military",
          "notes": "spec marks it '(rare)' colloquially; assigned epic bucket to honor scarcity intent"
        },
        {
          "name": "Black Flag",
          "sprite_filename": "pirate_black_flag.png",
          "rarity_bucket": "uncommon",
          "series": "pirate"
        },
        {
          "name": "Fog Fleet",
          "sprite_filename": "pirate_fog_fleet.png",
          "rarity_bucket": "uncommon",
          "series": "pirate"
        },
        {
          "name": "Crow's Nest",
          "sprite_filename": "pirate_crows_nest.png",
          "rarity_bucket": "uncommon",
          "series": "pirate"
        },
        {
          "name": "Hidden Cove",
          "sprite_filename": "pirate_hidden_cove.png",
          "rarity_bucket": "rare",
          "series": "pirate"
        },
        {
          "name": "Treasure Island",
          "sprite_filename": "pirate_treasure_island.png",
          "rarity_bucket": "rare",
          "series": "pirate"
        },
        {
          "name": "Ghost Fleet",
          "sprite_filename": "pirate_ghost_fleet.png",
          "rarity_bucket": "epic",
          "series": "pirate"
        },
        {
          "name": "Skeleton Crew",
          "sprite_filename": "pirate_skeleton_crew.png",
          "rarity_bucket": "epic",
          "series": "pirate"
        },
        {
          "name": "Green Magic",
          "sprite_filename": "wizard_green_magic.png",
          "rarity_bucket": "rare",
          "series": "wizard"
        },
        {
          "name": "Purple Magic",
          "sprite_filename": "wizard_purple_magic.png",
          "rarity_bucket": "rare",
          "series": "wizard"
        },